{
  "subscriber_id": "audit-direct",
  "subscription_id": "audit-direct-messages",
  "type": "relay",
  "webhook_group": "meta",
  "routing_scope": "application",
  "routing_key": "app-123",
  "url": "https://direct-subscriber.example.test/webhooks/meta",
  "metadata": {
    "environment": "production"
  },
  "match": {
    "version": "v1",
    "rules": {
      "headers.x-event-type": ["required", "in:message.created"],
      "body.account.id": ["required", "string", "in:account-42"]
    }
  }
}
